Kestrel,The Kestrel (Kestrel A),Red-Tail (Kestrel B),The Swallow (Kestrel C)
Engi,The Torus (Engi A),The Vortex (Engi B),Tetragon (Engi C)
Fed,The Osprey (Fed A),Nisos (Fed B),The Fregatidae (Fed C)
Zoltan,The Adjudicator (Zoltan A),Noether (Zoltan B),Cerenkov (Zoltan C)
Mantis,The Gila Monster (Mantis A),The Basilisk (Mantis B),The Theseus (Mantis C)
Slug,Man of War (Slug A),The Stormwalker (Slug B),Ariolimax (Slug C)
Rock,Bulwark (Rock A),Shivan (Rock B),Tektite (Rock C)
Stealth,The Nesasio (Stealth A),DA-SR 12 (Stealth B),Simo-H (Stealth C)
Lanius,Kruos (Lanius A),The Shrike (Lanius B)
Crystal,Bravais (Crystal A),Carnelian (Crystal B)